{
  "$schema": "http://json-schema.org/draft-07/schema#",
  "title": "question (one JSON object per file)",
  "description": "One question per .json file under <domain>/questions/ — the structured source of truth read by src/engine/store.ts (parseQuestionJson). Human/Obsidian-facing markdown is produced on demand by the exporter, not stored here. `templates/question.json` is the canonical example.",
  "type": "object",
  "required": ["id", "domain", "topic", "type", "grade_scale", "source", "created", "q", "answer", "explanation"],
  "properties": {
    "id": {
      "type": "string",
      "pattern": "^[a-z0-9-]+$",
      "description": "globally unique. Convention: <domain-with-dashes>-<topic>-<NN> (aws-clf-s3-03) or <domain-with-dashes>-<NNNN> (english-core-0001)."
    },
    "domain": { "type": "string", "pattern": "^[a-z0-9-]+/[a-z0-9-]+$", "description": "e.g. aws/clf, english/core" },
    "topic": { "type": "string", "description": "grouping key, e.g. s3, be-present" },
    "type": { "enum": ["single_choice", "multi", "cloze", "translation", "free"] },
    "grade_scale": { "type": "integer", "description": "4 = Again/Hard/Good/Easy" },
    "source": {
      "type": "array",
      "items": { "type": "string", "format": "uri" },
      "minItems": 1,
      "description": "primary-source URLs (required by policy; questions are generated from sources, not copied)"
    },
    "created": { "type": "string", "pattern": "^\\d{4}-\\d{2}-\\d{2}$" },
    "q": { "type": "string", "description": "the question prompt (Japanese for AWS; '日本語の指示 + 対象英文' for English)" },
    "choices": {
      "type": ["array", "null"],
      "items": { "type": "string" },
      "description": "present for single_choice / multi only; each item starts with its letter, e.g. 'A. …'. null/absent otherwise."
    },
    "answer": {
      "type": "string",
      "description": "single_choice: the correct letter ('B'); multi: comma-joined letters ('A,C'); cloze/translation/free: the model answer text."
    },
    "explanation": { "type": "string", "description": "key points in your own words (no source copy-paste); for choices, also why the others are wrong." },
    "hint": { "type": ["string", "null"], "description": "optional hint shown on demand (never the answer). null/absent if none — the app can ask Claude for one at study time." },
    "speak": { "type": ["string", "null"], "description": "optional text the app reads aloud with `say` (target-language sentence). null/absent for non-language questions." }
  },
  "allOf": [
    {
      "if": { "properties": { "type": { "enum": ["single_choice", "multi"] } } },
      "then": { "required": ["choices"], "properties": { "choices": { "type": "array", "minItems": 2 } } }
    }
  ],
  "additionalProperties": false
}
